{
  "schema_version": "cdd-question-category-map-v1",
  "mapping_version": "1.0.0",
  "methodology_id": "commercial_dd",
  "methodology_version_id": "commercial_dd:v1",
  "methodology_source_sha256": "57cfec98436514cae717e359fa872504a7b9e1115c7bc12a4561e0989c4281fc",
  "imported_registry_sha256": "13f38ef7afa9e96828ff723d32b650a16a9d4817f4dd6b5fab1bf0aafcdde2db",
  "classifier_version": "cdd-document-classifier-v2",
  "classifier_reachable_categories": [
    "business_plan_assumptions",
    "commercial_contracts",
    "commercial_risks",
    "competitive_landscape",
    "customer_evidence",
    "gtm_distribution",
    "management_team",
    "market_research",
    "pricing_unit_economics",
    "product_technology",
    "sales_pipeline"
  ],
  "classifier_reachable_categories_sha256": "2cfd5b237c4d078e59ac11d0f3d8320f44cb22f5f1cfc90e6c9f8da3b7aede8b",
  "questions": [
    {
      "methodology_question_id": "mq_commercial_dd_market_size_0001",
      "methodology_question_sha256": "18474c481d0838b1c34d29b1a4aaf5605cb3ddd9c4dd6f3501e5bbb00c95a959",
      "categories": ["market_research"]
    },
    {
      "methodology_question_id": "mq_commercial_dd_market_growth_0001",
      "methodology_question_sha256": "de9e1b3eaf54b393532edf363f3c64fb5823d2ecaadec9e772a8a18f120cba32",
      "categories": ["business_plan_assumptions", "market_research"]
    },
    {
      "methodology_question_id": "mq_commercial_dd_market_structure_0001",
      "methodology_question_sha256": "67b27481016265bf8d7d54a36eab0cfdab998d76023b45ad45641871324db042",
      "categories": ["market_research"]
    },
    {
      "methodology_question_id": "mq_commercial_dd_customer_segments_0001",
      "methodology_question_sha256": "1a7f3226ec294946d7ca53cc3761447e522e644467ca28761e0391eb6bc57d43",
      "categories": ["customer_evidence", "sales_pipeline"]
    },
    {
      "methodology_question_id": "mq_commercial_dd_customer_concentration_0001",
      "methodology_question_sha256": "c9954d46179cc99869afd10aac77017ab42e64738ee38531acdcf23c3683b8dd",
      "categories": ["commercial_contracts", "customer_evidence"]
    },
    {
      "methodology_question_id": "mq_commercial_dd_customer_quality_0001",
      "methodology_question_sha256": "bb9c37eab2366d18432bb49f299ba8f6eb92fb04c3e23122f23b21589d6707c5",
      "categories": ["customer_evidence"]
    },
    {
      "methodology_question_id": "mq_commercial_dd_churn_retention_0001",
      "methodology_question_sha256": "9b9789c0797a69333ed1d7f996ecd2141033e53c6f054875004c8eff123d8d30",
      "categories": ["customer_evidence", "sales_pipeline"]
    },
    {
      "methodology_question_id": "mq_commercial_dd_sales_pipeline_0001",
      "methodology_question_sha256": "5f42c38ecd89a1c68817697a3c3282bb536fe42f89161a4c523e22db4f895692",
      "categories": ["sales_pipeline"]
    },
    {
      "methodology_question_id": "mq_commercial_dd_pricing_0001",
      "methodology_question_sha256": "d7381dacc2a10f398f3b51a356f81fb974a353c8aaf5d1f932aa8b0dfb04d879",
      "categories": ["commercial_contracts", "pricing_unit_economics", "sales_pipeline"]
    },
    {
      "methodology_question_id": "mq_commercial_dd_unit_economics_0001",
      "methodology_question_sha256": "b80f2c01100bee0fbb8e7a3da7944d645b8e8f2f4450f1d1c765730b1b38155d",
      "categories": ["business_plan_assumptions", "pricing_unit_economics", "sales_pipeline"]
    },
    {
      "methodology_question_id": "mq_commercial_dd_gtm_model_0001",
      "methodology_question_sha256": "0b76f17579db7b0343234bab5e08c76eae7d6fc3aa77c4c1fb8f2c9a031dfb40",
      "categories": ["gtm_distribution", "sales_pipeline"]
    },
    {
      "methodology_question_id": "mq_commercial_dd_distribution_0001",
      "methodology_question_sha256": "84ab5f5d1df51072651e1effe93816b0c8df0b9e0c02590779881addb83147a0",
      "categories": ["gtm_distribution", "sales_pipeline"]
    },
    {
      "methodology_question_id": "mq_commercial_dd_competition_0001",
      "methodology_question_sha256": "7d7e4c1d35c6ab44665328f4795f720f487ae28f2b71c01ef4b55dfa15af79b1",
      "categories": ["competitive_landscape", "market_research"]
    },
    {
      "methodology_question_id": "mq_commercial_dd_pmf_0001",
      "methodology_question_sha256": "3f8ea9336a3089dea137b29463d473a8fc1533892afcf375916bd38546b75899",
      "categories": ["customer_evidence", "product_technology"]
    },
    {
      "methodology_question_id": "mq_commercial_dd_technology_diff_0001",
      "methodology_question_sha256": "1d2427268a998484b7aaf628b8fa362e211530f499f2f57c3349f96b0fb692e3",
      "categories": ["product_technology"]
    },
    {
      "methodology_question_id": "mq_commercial_dd_contracts_0001",
      "methodology_question_sha256": "1b28bf4b1f1c02ea4f7eb80e7352d94cb7970d357b3fc2284d3a5680a2cdf8e7",
      "categories": ["commercial_contracts"]
    },
    {
      "methodology_question_id": "mq_commercial_dd_revenue_drivers_0001",
      "methodology_question_sha256": "c735b3e004982272cc2cefc4fc63850a4258c2699044f91ae9c064fdb048af88",
      "categories": ["business_plan_assumptions", "sales_pipeline"]
    },
    {
      "methodology_question_id": "mq_commercial_dd_expansion_0001",
      "methodology_question_sha256": "76e68bf3b2ff762f248e286ce70b47b160ba879a87522cfacc2ef44eb3310dc5",
      "categories": ["customer_evidence", "sales_pipeline"]
    },
    {
      "methodology_question_id": "mq_commercial_dd_management_0001",
      "methodology_question_sha256": "a9e19f3ed7c0205d3de431a8e7b470162b428dd975fd346064c135d49457e1ce",
      "categories": ["management_team"]
    },
    {
      "methodology_question_id": "mq_commercial_dd_risks_0001",
      "methodology_question_sha256": "aa0fe543ce2ade65fe5752b8e1098b785ee1cc52cbc4ac9d795741d9dfd679da",
      "categories": ["commercial_risks"]
    },
    {
      "methodology_question_id": "mq_commercial_dd_growth_assumptions_0001",
      "methodology_question_sha256": "fa69888afc7a327593623cd15567e42657744de15f5745c2c5bc7bce960d54e4",
      "categories": ["business_plan_assumptions"]
    }
  ]
}
